{
  "$schema": "https://json-schema.org/draft/2020-12/schema",
  "$id": "https://github.com/notmike101/zcode-extensions/blob/main/sdk/manifest.schema.json",
  "title": "ZCode Desktop Extension Manifest",
  "type": "object",
  "additionalProperties": false,
  "required": ["apiVersion", "id", "name", "version", "entrypoints"],
  "properties": {
    "apiVersion": {"const": 1},
    "id": {"type": "string", "pattern": "^[a-z0-9](?:[a-z0-9.-]{0,62}[a-z0-9])?$"},
    "name": {"type": "string", "minLength": 1, "maxLength": 80},
    "version": {"type": "string", "minLength": 1},
    "description": {"type": "string", "maxLength": 500},
    "entrypoints": {
      "type": "object",
      "additionalProperties": false,
      "properties": {
        "main": {"type": "string", "minLength": 1, "pattern": "^(?![\\\\/])(?!.*\\.\\.).+$"},
        "renderer": {"type": "string", "minLength": 1, "pattern": "^(?![\\\\/])(?!.*\\.\\.).+$"}
      },
      "minProperties": 1
    },
    "engines": {
      "type": "object",
      "additionalProperties": false,
      "properties": {
        "host": {"type": "string", "minLength": 1, "default": ">=0.1.0"},
        "zcode": {"type": "string", "minLength": 1, "default": ">=3.3.6"}
      },
      "default": {"host": ">=0.1.0", "zcode": ">=3.3.6"}
    },
    "pages": {
      "type": "array",
      "items": {
        "type": "object",
        "additionalProperties": false,
        "required": ["id", "title"],
        "properties": {
          "id": {"type": "string", "pattern": "^[a-z0-9](?:[a-z0-9.-]{0,62}[a-z0-9])?$"},
          "title": {"type": "string", "minLength": 1, "maxLength": 40}
        }
      },
      "default": []
    },
    "capabilities": {
      "type": "array",
      "uniqueItems": true,
      "maxItems": 19,
      "items": {
        "enum": [
          "zcode.workspaces.read", "zcode.sessions.read", "zcode.sessions.events", "zcode.sessions.write",
          "zcode.tasks.read", "zcode.tasks.run", "zcode.tasks.write", "zcode.models.read",
          "zcode.models.generate", "zcode.usage.read", "zcode.broadcast", "ui.pages", "ui.navigation",
          "ui.workspace", "ui.tasks", "ui.chat", "ui.overlays", "experimental.zcode.rpc", "experimental.ui.dom"
        ]
      }
    }
  }
}
